Symbol,Name,Last Sale,Net Change,% Change,Market Cap,Country,IPO Year,Volume,Sector,Industry
CYRX,CryoPort Inc. Common Stock,$8.27,-0.17,-2.014%,414069836.00,United States,,275238,Health Care,Biotechnology: Pharmaceutical Preparations
CYTK,Cytokinetics Incorporated Common Stock,$70.10,2.16,3.179%,8570771523.00,United States,2004,1945972,Health Care,Biotechnology: Pharmaceutical Preparations
CZNC,Citizens & Northern Corp Common Stock,$22.74,-1.10,-4.614%,404814592.00,United States,,45159,Finance,Major Banks
CZR,Caesars Entertainment Inc. Common Stock,$20.34,-0.89,-4.192%,4139617567.00,United States,,4907080,Consumer Discretionary,Hotels/Resorts
D,Dominion Energy Inc. Common Stock,$63.74,-0.49,-0.763%,54428432276.00,United States,,6820075,Utilities,Electric Utilities: Central
DAKT,Daktronics Inc. Common Stock,$27.34,-0.39,-1.406%,1332765317.00,United States,1994,721923,Consumer Discretionary,Miscellaneous manufacturing industries
DAL,Delta Air Lines Inc. Common Stock,$69.23,2.35,3.514%,45216238915.00,United States,,9026675,Consumer Discretionary,Air Freight/Delivery Services
DAN,Dana Incorporated Common Stock ,$35.74,0.90,2.583%,4175767461.00,United States,,1447136,Consumer Discretionary,Auto Parts:O.E.M.
DAR,Darling Ingredients Inc. Common Stock,$52.68,1.04,2.014%,8333242800.00,United States,1997,2225057,Consumer Staples,Packaged Foods
DASH,DoorDash Inc. Class A Common Stock,$164.38,-11.91,-6.756%,70847536553.00,United States,,5929705,Technology,EDP Services
DAVE,Dave Inc. Class A Common Stock,$169.31,-7.20,-4.079%,2286376123.00,United States,,271196,Finance,Finance: Consumer Services
DAWN,Day One Biopharmaceuticals Inc. Common Stock,$12.02,0.24,2.037%,1234159534.00,United States,2021,2057810,Health Care,Biotechnology: Pharmaceutical Preparations
DBI,Designer Brands Inc. Class A Common Stock,$7.38,-0.08,-1.072%,366314359.00,United States,,457854,Consumer Discretionary,Clothing/Shoe/Accessory Stores
DBRG,DigitalBridge Group Inc.,$15.39,0.02,0.13%,2811359401.00,United States,2014,6932987,Real Estate,Real Estate Investment Trusts
DBX,Dropbox Inc. Class A Common Stock,$24.28,-1.20,-4.71%,5856052361.00,United States,2018,6319489,Technology,Computer Software: Prepackaged Software
DC,Dakota Gold Corp. Common Stock,$6.55,0.19,2.987%,741866716.00,United States,2022,1722220,Basic Materials,Metal Mining
DCH,Dauch Corporation Common Stock,$6.98,0.26,3.869%,1647174790.00,United States,,4753388,Consumer Discretionary,Auto Parts:O.E.M.
DCI,Donaldson Company Inc. Common Stock,$106.88,0.12,0.112%,12327185107.00,United States,,616595,Industrials,Pollution Control Equipment
DCO,Ducommun Incorporated Common Stock,$125.80,1.07,0.858%,1880213342.00,United States,,180855,Industrials,Military/Government/Technical
DCOM,Dime Community Bancshares Inc. Common Stock,$32.62,-1.65,-4.815%,1432210067.00,United States,,260981,Finance,Major Banks
DCOMG,Dime Community Bancshares Inc. 9.000% Fixed-to-Floating Rate Subordinated Notes due 2034,$26.69,0.3399,1.29%,1044877122.00,United States,,3369,Finance,Major Banks
DCOMP,Dime Community Bancshares Inc. Fixed-Rate Non-Cumulative Perpetual Preferred Stock Series A,$19.43,-0.25,-1.27%,853091404.00,United States,,3310,Finance,Major Banks
DCTH,Delcath Systems Inc. Common Stock,$9.95,0.17,1.738%,345265000.00,United States,,234179,Health Care,Medical/Dental Instruments
DD,DuPont de Nemours Inc. Common Stock,$51.07,0.99,1.977%,20883741377.00,United States,2017,2532310,Industrials,Major Chemicals
DDOG,Datadog Inc. Class A Common Stock,$104.43,-11.23,-9.709%,36819520139.00,United States,2019,7568441,Technology,Computer Software: Prepackaged Software
DDS,Dillard's Inc. Common Stock,$595.88,-50.30,-7.784%,9303454180.00,United States,,302493,Consumer Discretionary,Department/Specialty Retail Stores
DDT,Dillard's Capital Trust I,$26.25,-0.01,-0.038%,409840358.00,United States,,7339,Consumer Discretionary,Department/Specialty Retail Stores
DE,Deere & Company Common Stock,$644.54,-2.30,-0.356%,174312901964.00,United States,,1399191,Industrials,Industrial Machinery/Components
DEA,Easterly Government Properties Inc. Common Stock,$23.40,-0.09,-0.383%,1078936069.00,United States,2015,835352,Real Estate,Real Estate Investment Trusts
DECK,Deckers Outdoor Corporation Common Stock,$120.94,2.77,2.344%,17167429493.00,United States,1993,2436204,Consumer Discretionary,Shoe Manufacturing
DEI,Douglas Emmett Inc. Common Stock,$10.08,-0.05,-0.494%,1688019127.00,United States,2006,2284693,Real Estate,Real Estate Investment Trusts
DELL,Dell Technologies Inc. Class C Common Stock ,$119.78,0.64,0.537%,79376960887.00,United States,2018,4931140,Technology,Computer Manufacturing
DFH,Dream Finders Homes Inc. Class A Common Stock,$19.20,-0.83,-4.144%,1780890586.00,United States,2022,523333,Consumer Discretionary,Homebuilding
DFIN,Donnelley Financial Solutions Inc. Common Stock ,$49.01,2.04,4.343%,1300582438.00,United States,2016,229315,Consumer Discretionary,Other Consumer Services
DFTX,Definium Therapeutics Inc. Common Shares,$17.45,0.32,1.868%,1718986919.00,United States,,705534,Health Care, Medicinal Chemicals and Botanical Products 
DG,Dollar General Corporation Common Stock,$153.96,1.06,0.693%,33889501379.00,United States,2009,2194480,Consumer Discretionary,Department/Specialty Retail Stores
DGICA,Donegal Group Inc. Class A Common Stock,$17.44,0.05,0.288%,639028824.00,United States,,174272,Finance,Property-Casualty Insurers
DGICB,Donegal Group Inc. Class B Common Stock,$15.6025,-0.4175,-2.606%,571699956.00,United States,1986,42,Finance,Property-Casualty Insurers
DGII,Digi International Inc. Common Stock,$48.50,-1.70,-3.386%,1824141260.00,United States,1989,341493,Telecommunications,Computer Communications Equipment
DGX,Quest Diagnostics Incorporated Common Stock,$209.54,2.11,1.017%,23309724533.00,United States,,882101,Health Care,Medical Specialities
DHC,Diversified Healthcare Trust Common Shares of Beneficial Interest,$6.10,-0.14,-2.244%,1477096468.00,United States,,2109082,Real Estate,Real Estate Investment Trusts
DHCNI,Diversified Healthcare Trust 5.625% Senior Notes due 2042,$17.60,-0.27,-1.511%,4248892683.00,United States,,286,Real Estate,Real Estate Investment Trusts
DHCNL,Diversified Healthcare Trust 6.25% Senior Notes Due 2046,$18.10,-0.08,-0.44%,4369599862.00,United States,,4975,Real Estate,Real Estate Investment Trusts
DHI,D.R. Horton Inc. Common Stock,$163.95,-0.30,-0.183%,47496871610.00,United States,,2232726,Consumer Discretionary,Homebuilding
DHIL,Diamond Hill Investment Group Inc. Class A Common Stock,$171.63,0.41,0.239%,464309952.00,United States,,67847,Finance,Investment Managers
DHR,Danaher Corporation Common Stock,$209.19,-1.73,-0.82%,147761265084.00,United States,,3176039,Industrials,Industrial Machinery/Components
DIN,Dine Brands Global Inc. Common Stock,$30.64,-0.04,-0.13%,441942137.00,United States,,709278,Consumer Discretionary,Restaurants
DINO,HF Sinclair Corporation Common Stock,$49.64,0.05,0.101%,9131190286.00,United States,1960,2502157,Energy,Natural Gas Distribution
DIOD,Diodes Incorporated Common Stock,$69.29,0.84,1.227%,3178849065.00,United States,,315635,Technology,Semiconductors
DIS,Walt Disney Company (The) Common Stock,$106.05,1.64,1.571%,187869680199.00,United States,,13593708,Consumer Discretionary,Services-Misc. Amusement & Recreation
DJCO,Daily Journal Corp. (S.C.) Common Stock,$515.08,-7.44,-1.424%,709637048.00,United States,,76603,Consumer Discretionary,Newspapers/Magazines
DJT,Trump Media & Technology Group Corp. Common Stock,$10.63,0.52,5.143%,2976374871.00,United States,2024,3154730,Technology,Computer Software: Programming Data Processing
DJTWW,Trump Media & Technology Group Corp. Warrants,$6.05,0.55,10.00%,1693985698.00,United States,2021,39510,Technology,Computer Software: Programming Data Processing
DK,Delek US Holdings Inc. Common Stock,$34.00,0.75,2.256%,2041752802.00,United States,2017,878443,Energy,Integrated oil Companies
DKL,Delek Logistics Partners L.P. Common Units representing Limited Partner Interests,$53.74,0.27,0.505%,2874036750.00,United States,2012,39202,Energy,Natural Gas Distribution
DKNG,DraftKings Inc. Class A Common Stock,$22.37,0.06,0.269%,11028217282.00,United States,2019,12465619,Consumer Discretionary,Services-Misc. Amusement & Recreation
DKS,Dick's Sporting Goods Inc Common Stock,$212.49,1.15,0.544%,19117492836.00,United States,2002,1131142,Consumer Discretionary,Other Specialty Stores
DLR,Digital Realty Trust Inc. Common Stock,$178.24,2.15,1.221%,61246016739.00,United States,2004,1373007,Real Estate,Real Estate Investment Trusts
DLTR,Dollar Tree Inc. Common Stock,$131.71,-2.80,-2.082%,26190953260.00,United States,1995,1976899,Consumer Discretionary,Department/Specialty Retail Stores
DLX,Deluxe Corporation Common Stock,$26.86,0.39,1.473%,1210889063.00,United States,,439506,Consumer Discretionary,Publishing
DLY,DoubleLine Yield Opportunities Fund Common Shares of Beneficial Interest,$14.68,-0.02,-0.136%,703844036.00,United States,2020,186530,Finance,Investment Managers
DMAC,DiaMedica Therapeutics Inc. Common Stock,$8.55,0.13,1.544%,445262103.00,United States,2018,173663,Health Care,Biotechnology: Pharmaceutical Preparations
DMLP,Dorchester Minerals L.P. Common Units Representing Limited Partnership Interests,$25.47,0.11,0.434%,1229066312.00,United States,,184677,Energy,Oil & Gas Production
DNA,Ginkgo Bioworks Holdings Inc. Class A Common Stock,$8.86,0.00,0.00%,536829340.00,United States,2021,554963,Health Care,Biotechnology: Biological Products (No Diagnostic Substances)
DNLI,Denali Therapeutics Inc. Common Stock,$21.43,1.24,6.142%,3338120648.00,United States,2017,1432120,Health Care,Biotechnology: Biological Products (No Diagnostic Substances)
DNOW,DNOW Inc. Common Stock,$11.87,0.02,0.169%,1246492036.00,United States,2014,7340789,Consumer Discretionary,Oil and Gas Field Machinery
DNTH,Dianthus Therapeutics Inc. Common Stock,$52.86,3.30,6.659%,2284772537.00,United States,2018,570816,Health Care,Biotechnology: Pharmaceutical Preparations
DNUT,Krispy Kreme Inc. Common Stock,$2.96,-0.07,-2.31%,507048000.00,United States,2021,1844042,Consumer Staples,Food Chains
DOC,Healthpeak Properties Inc. Common Stock,$17.25,-0.05,-0.289%,11989508948.00,United States,,6295385,Real Estate,Real Estate Investment Trusts
DOCN,DigitalOcean Holdings Inc. Common Stock,$62.74,3.50,5.908%,5740216989.00,United States,2021,7346383,Technology,Computer Software: Programming Data Processing
DOCS,Doximity Inc. Class A Common Stock,$24.07,0.31,1.305%,4445944619.00,United States,2021,2940416,Technology,EDP Services
DOCU,DocuSign Inc. Common Stock,$42.85,-1.63,-3.665%,8581686909.00,United States,1989,8309633,Technology,Computer Software: Prepackaged Software
DORM,Dorman Products Inc. Common Stock,$126.40,-3.29,-2.537%,3863118202.00,United States,,122594,Consumer Discretionary,Auto Parts:O.E.M.
DOV,Dover Corporation Common Stock,$231.35,0.62,0.269%,31201393925.00,United States,,1048626,Industrials,Industrial Machinery/Components
DOW,Dow Inc. Common Stock ,$31.05,0.75,2.475%,22279432936.00,United States,2019,10485471,Industrials,Major Chemicals
DPZ,Domino's Pizza Inc Common Stock,$414.20,29.59,7.694%,13994251496.00,United States,2004,1385801,Consumer Discretionary,Food Distributors
DRH,Diamondrock Hospitality Company Common Stock,$10.02,0.09,0.906%,2041105884.00,United States,2005,3458402,Real Estate,Real Estate Investment Trusts
DRI,Darden Restaurants Inc. Common Stock,$213.92,-0.34,-0.159%,24630588146.00,United States,,937768,Consumer Discretionary,Restaurants
DRVN,Driven Brands Holdings Inc. Common Stock,$16.61,-0.47,-2.752%,2731584561.00,United States,2021,1176641,Consumer Discretionary,Automotive Aftermarket
DSGN,Design Therapeutics Inc. Common Stock,$10.60,0.49,4.847%,603815824.00,United States,2021,186938,Health Care,Biotechnology: Pharmaceutical Preparations
DSGR,Distribution Solutions Group Inc. Common Stock,$29.79,-0.92,-2.996%,1377125685.00,United States,,51204,Consumer Discretionary,Industrial Specialties
DSL,DoubleLine Income Solutions Fund Common Shares of Beneficial Interests,$11.48,0.012,0.105%,1170923585.00,United States,2013,387873,Finance,Trusts Except Educational Religious and Charitable
DSP,Viant Technology Inc. Class A Common Stock,$9.16,-0.34,-3.579%,571891831.00,United States,2021,144045,Technology,Computer Software: Programming Data Processing
DT,Dynatrace Inc. Common Stock,$34.25,0.61,1.813%,10215100655.00,United States,2019,5128082,Technology,Computer Software: Prepackaged Software
DTB,DTE Energy Company 2020 Series G 4.375% Junior Subordinated Debentures due 2080,$17.62,0.00,0.00%,3661502322.00,United States,2020,6135,Utilities,Electric Utilities: Central
DTE,DTE Energy Company Common Stock,$146.09,0.24,0.165%,30358051883.00,United States,,1066050,Utilities,Electric Utilities: Central
DTG,DTE Energy Company 2021 Series E 4.375% Junior Subordinated Debentures,$17.39,-0.02,-0.115%,3613707456.00,United States,2021,13202,Utilities,Electric Utilities: Central
DTM,DT Midstream Inc. Common Stock ,$137.17,-0.74,-0.537%,13953134177.00,United States,2021,1340763,Utilities,Natural Gas Distribution
DTW,DTE Energy Company 2017 Series E 5.25% Junior Subordinated Debentures due 2077,$22.34,-0.02,-0.089%,4642336088.00,United States,2017,103302,Utilities,Electric Utilities: Central
DUK,Duke Energy Corporation (Holding Company) Common Stock,$128.46,0.67,0.524%,99898360835.00,United States,,4231878,Utilities,Power Generation
DUKB,Duke Energy Corporation 5.625% Junior Subordinated Debentures due 2078,$24.79,0.01,0.04%,19278221743.00,United States,2018,28706,Utilities,Power Generation
DUOL,Duolingo Inc. Class A Common Stock,$109.43,-3.51,-3.108%,5058659677.00,United States,2021,1796985,Technology,Computer Software: Prepackaged Software
DV,DoubleVerify Holdings Inc. Common Stock,$9.15,0.30,3.39%,1474131008.00,United States,2021,3346503,Technology,Computer Software: Programming Data Processing
DVA,DaVita Inc. Common Stock,$150.91,-0.37,-0.245%,10080788000.00,United States,,697064,Health Care,Misc Health and Biotechnology Services
DVLT,Datavault AI Inc. Common Stock,$0.7025,-0.0277,-3.793%,408416762.00,United States,2018,23217129,Technology,Semiconductors
DVN,Devon Energy Corporation Common Stock,$43.28,-0.39,-0.893%,26833600000.00,United States,1985,9063722,Energy,Oil & Gas Production
DX,Dynex Capital Inc. Common Stock,$13.95,-0.02,-0.143%,3378258931.00,United States,,5303911,Real Estate,Real Estate Investment Trusts
DXC,DXC Technology Company Common Stock ,$11.92,0.07,0.591%,2023538759.00,United States,,3284563,Technology,EDP Services
DXCM,DexCom Inc. Common Stock,$73.09,0.01,0.014%,28129771302.00,United States,2005,4141599,Health Care,Medical/Dental Instruments
DXPE,DXP Enterprises Inc. Common Stock,$159.37,10.24,6.866%,2498808447.00,United States,,131571,Industrials,Industrial Machinery/Components
DY,Dycom Industries Inc. Common Stock,$428.58,8.24,1.96%,12409984338.00,United States,,259735,Industrials,Water Sewer Pipeline Comm & Power Line Construction
DYN,Dyne Therapeutics Inc. Common Stock,$15.54,0.66,4.435%,2511166502.00,United States,2020,1882656,Health Care,Biotechnology: Pharmaceutical Preparations
EA,Electronic Arts Inc. Common Stock,$201.00,0.60,0.299%,50300996313.00,United States,,2863495,Consumer Discretionary,Services-Misc. Amusement & Recreation
EAI,Entergy Arkansas LLC First Mortgage Bonds 4.875% Series Due September 1 2066,$21.575,0.055,0.256%,9773255733.00,United States,2016,16013,Utilities,Electric Utilities: Central
EAT,Brinker International Inc. Common Stock,$141.16,0.38,0.27%,6147564300.00,United States,,1088855,Consumer Discretionary,Restaurants
EB,Eventbrite Inc. Class A Common Stock,$4.42,0.00,0.00%,431724190.00,United States,2018,488981,Technology,Computer Software: Programming Data Processing
EBAY,eBay Inc. Common Stock,$85.30,-2.77,-3.145%,38214400000.00,United States,1998,5929157,Real Estate,Real Estate
EBC,Eastern Bankshares Inc. Common Stock,$20.43,-0.99,-4.622%,4306601710.00,United States,2020,2091345,Finance,Savings Institutions
EBF,Ennis Inc. Common Stock,$21.10,0.32,1.54%,533679473.00,United States,,124131,Consumer Discretionary,Office Equipment/Supplies/Services
EBS,Emergent BioSolutions Inc. Common Stock,$10.96,0.01,0.091%,575618805.00,United States,2006,1052256,Health Care,Biotechnology: Pharmaceutical Preparations
ECAT,BlackRock ESG Capital Allocation Term Trust Common Shares of Beneficial Interest,$15.11,0.12,0.801%,1633919850.00,United States,2021,355137,Finance,Trusts Except Educational Religious and Charitable
ECCC,Eagle Point Credit Company Inc. 6.50% Series C Term Preferred Stock due 2031,$24.71,0.035,0.142%,1498970968.00,United States,,7329,Finance,Trusts Except Educational Religious and Charitable
ECCV,Eagle Point Credit Company Inc. 5.375% Notes due 2029,$23.58,-0.05,-0.212%,1430422316.00,United States,2022,9681,Finance,Trusts Except Educational Religious and Charitable
ECCW,Eagle Point Credit Company Inc. 6.75% Notes due 2031,$24.99,0.00,0.00%,1515956475.00,United States,2021,4942,Finance,Trusts Except Educational Religious and Charitable
ECCX,Eagle Point Credit Company Inc. 6.6875% Notes due 2028,$25.0501,0.0301,0.12%,1519602292.00,United States,2022,2709,Finance,Trusts Except Educational Religious and Charitable
ECG,Everus Construction Group Inc. Common Stock,$104.21,-1.87,-1.763%,5315395181.00,United States,2024,885396,Consumer Discretionary,Homebuilding
ECL,Ecolab Inc. Common Stock,$308.16,2.49,0.815%,87281898828.00,United States,,1100083,Consumer Discretionary,Package Goods/Cosmetics
ECPG,Encore Capital Group Inc Common Stock,$58.02,-0.39,-0.668%,1294059282.00,United States,,131274,Finance,Finance Companies
ECVT,Ecovyst Inc. Common Stock,$11.59,0.17,1.489%,1321485008.00,United States,2017,1067633,Industrials,Major Chemicals
ED,Consolidated Edison Inc. Common Stock,$111.01,-1.13,-1.008%,40102078092.00,United States,,6870305,Utilities,Power Generation
EE,Excelerate Energy Inc. Class A Common Stock,$42.44,0.06,0.142%,4839474367.00,United States,2022,329029,Utilities,Oil/Gas Transmission
EEFT,Euronet Worldwide Inc. Common Stock,$68.87,-3.63,-5.007%,2895617180.00,United States,1997,726284,Finance,Investment Bankers/Brokers/Service
EEX,Emerald Holding Inc. Common Stock,$4.25,-0.01,-0.235%,840681259.00,United States,2017,19386,Real Estate,Real Estate
EFC,Ellington Financial Inc. Common Stock ,$12.46,0.05,0.403%,1553126827.00,United States,2010,2154991,Finance,Real Estate
EFSC,Enterprise Financial Services Corporation Common Stock,$57.57,-3.87,-6.299%,2130718031.00,United States,,167807,Finance,Major Banks
EFSCP,Enterprise Financial Services Corporation Depositary Shares Each Representing a 1/40th Interest in a Share of 5% Fixed Rate Non-Cumulative Perpetual Preferred Stock Series A,$20.54,-0.16,-0.773%,760204071.00,United States,,6,Finance,Major Banks
EFT,Eaton Vance Floating Rate Income Trust Common Shares of Beneficial Interest,$11.05,-0.03,-0.271%,321449086.00,United States,2004,57261,Finance,Finance Companies
EFX,Equifax Inc. Common Stock,$194.32,5.89,3.126%,23370866011.00,United States,,1525186,Finance,Finance: Consumer Services
EGBN,Eagle Bancorp Inc. Common Stock,$25.38,-1.13,-4.263%,770821970.00,United States,,282770,Finance,Major Banks
EGP,EastGroup Properties Inc. Common Stock,$190.57,-0.83,-0.434%,10163899637.00,United States,,549396,Real Estate,Real Estate Investment Trusts
EGY,VAALCO Energy Inc.  Common Stock,$5.19,0.15,2.976%,541100333.00,United States,,971013,Energy,Oil & Gas Production
EHAB,Enhabit Inc. Common Stock,$13.56,-0.04,-0.294%,686231937.00,United States,2022,4681746,Health Care,Medical/Nursing Services
EHC,Encompass Health Corporation Common Stock,$104.84,-1.31,-1.234%,10548579029.00,United States,,977473,Health Care,Hospital/Nursing Management
EIG,Employers Holdings Inc Common Stock,$40.20,0.99,2.525%,903660061.00,United States,2007,514316,Finance,Property-Casualty Insurers
EIKN,Eikon Therapeutics Inc. Common Stock,$14.90,0.02,0.134%,804366621.00,United States,2026,336038,Health Care,Biotechnology: Biological Products (No Diagnostic Substances)
EIX,Edison International Common Stock,$75.24,0.59,0.79%,28951378093.00,United States,,3600756,Utilities,Electric Utilities: Central
EL,Estee Lauder Companies Inc. (The) Common Stock,$115.29,2.27,2.008%,41703510787.00,United States,1995,3379126,Consumer Discretionary,Package Goods/Cosmetics
ELA,Envela Corporation Common Stock,$13.20,0.23,1.773%,342717883.00,United States,,50174,Consumer Discretionary,Consumer Specialties
ELAN,Elanco Animal Health Incorporated Common Stock,$26.38,1.63,6.586%,13107258418.00,United States,2018,8571932,Health Care,Biotechnology: Pharmaceutical Preparations
ELC,Entergy Louisiana Inc. Collateral Trust Mortgage Bonds 4.875 % Series due September 1 2066,$21.07,-0.03,-0.142%,4492915221.00,United States,2016,14907,Utilities,Electric Utilities: Central
ELF,e.l.f. Beauty Inc. Common Stock,$94.83,4.76,5.285%,5599923824.00,United States,2016,1467188,Consumer Discretionary,Package Goods/Cosmetics
ELS,Equity Lifestyle Properties Inc. Common Stock,$68.32,0.36,0.53%,13249131651.00,United States,,1546149,Real Estate,Real Estate Investment Trusts
ELV,Elevance Health Inc. Common Stock,$327.14,-8.73,-2.599%,72201324762.00,United States,,1253517,Health Care,Medical Specialities
ELVN,Enliven Therapeutics Inc. Common Stock,$28.32,2.30,8.839%,1680716017.00,United States,2020,871364,Health Care,Biotechnology: Pharmaceutical Preparations
EMBC,Embecta Corp. Common Stock,$10.28,-0.45,-4.194%,608780099.00,United States,,901368,Health Care,Medical/Dental Instruments
EME,EMCOR Group Inc. Common Stock,$806.80,0.14,0.017%,36117099075.00,United States,,385672,Industrials,Engineering & Construction
EMN,Eastman Chemical Company Common Stock,$77.12,0.55,0.718%,8799184856.00,United States,,1111658,Industrials,Major Chemicals
EMP,Entergy Mississippi LLC First Mortgage Bonds 4.90% Series Due October 1 2066,$21.1411,0.0411,0.195%,9576703443.00,United States,2016,15108,Utilities,Electric Utilities: Central
EMR,Emerson Electric Company Common Stock,$150.88,5.37,3.69%,84764384000.00,United States,,2926863,Technology,Consumer Electronics/Appliances
ENJ,Entergy New Orleans LLC First Mortgage Bonds 5.0% Series due December 1 2052,$21.38,0.11,0.517%,9684922715.00,United States,,620,Utilities,Power Generation
ENO,Entergy New Orleans LLC First Mortgage Bonds 5.50% Series due April 1 2066,$23.08,0.113,0.492%,4935215926.00,United States,2016,3077,Utilities,Power Generation
ENOV,Enovis Corporation Common Stock,$22.88,0.46,2.052%,1308493037.00,United States,,1168108,Health Care,Industrial Specialties
ENPH,Enphase Energy Inc. Common Stock,$49.74,3.18,6.83%,6520855257.00,United States,2012,5969092,Technology,Semiconductors
ENS,EnerSys Common Stock,$172.62,5.20,3.106%,6361284180.00,United States,2004,596567,Technology,Industrial Machinery/Components
ENSG,The Ensign Group Inc. Common Stock,$212.39,1.75,0.831%,12342573344.00,United States,2007,415602,Health Care,Hospital/Nursing Management
ENTA,Enanta Pharmaceuticals Inc. Common Stock,$14.75,1.24,9.178%,428035324.00,United States,2013,334788,Health Care,Biotechnology: Pharmaceutical Preparations
ENTG,Entegris Inc. Common Stock,$136.27,1.78,1.324%,20713040000.00,United States,2000,2435910,Industrials,Plastic Products
ENVA,Enova International Inc. Common Stock,$138.00,1.76,1.292%,3451424022.00,United States,2014,238226,Finance,Finance: Consumer Services
EOG,EOG Resources Inc. Common Stock,$123.70,1.39,1.136%,69274782632.00,United States,,6262913,Energy,Oil & Gas Production
EPAC,Enerpac Tool Group Corp. Common Stock,$41.75,0.73,1.78%,2203410734.00,United States,,314197,Technology,Industrial Machinery/Components
EPAM,EPAM Systems Inc. Common Stock,$128.82,-1.14,-0.877%,7116354051.00,United States,2012,1843716,Technology,EDP Services
EPC,Edgewell Personal Care Company Common Stock,$22.57,0.22,0.984%,1054393775.00,United States,,702712,Consumer Discretionary,Package Goods/Cosmetics
EPD,Enterprise Products Partners L.P. Common Stock,$36.29,-0.07,-0.193%,78506920905.00,United States,,3660357,Utilities,Natural Gas Distribution
EPR,EPR Properties Common Stock,$58.80,-0.23,-0.39%,4477052051.00,United States,1997,733948,Real Estate,Real Estate Investment Trusts
EPRT,Essential Properties Realty Trust Inc. Common Stock,$33.27,0.16,0.483%,6982701545.00,United States,2018,2030167,Real Estate,Real Estate Investment Trusts
EQBK,Equity Bancshares Inc. Class A Common Stock,$45.64,0.39,0.862%,870647444.00,United States,,91261,Finance,Major Banks
EQH,Equitable Holdings Inc. Common Stock,$41.11,0.90,2.238%,11779332123.00,United States,2018,5269094,Finance,Specialty Insurers
EQIX,Equinix Inc. Common Stock REIT,$951.90,23.79,2.563%,93528865963.00,United States,2000,486143,Real Estate,Real Estate Investment Trusts
EQPT,EquipmentShare.com Inc Class A Common Stock,$29.88,-1.67,-5.293%,7508332873.00,United States,2026,809293,Consumer Discretionary,Diversified Commercial Services
EQR,Equity Residential Common Shares of Beneficial Interest,$63.56,0.24,0.379%,23996894184.00,United States,,2002351,Real Estate,Real Estate Investment Trusts
EQT,EQT Corporation Common Stock,$58.41,-0.62,-1.05%,36463844340.00,United States,,8557418,Energy,Oil & Gas Production
ERAS,Erasca Inc. Common Stock,$13.61,1.07,8.533%,4167542666.00,United States,2021,3607528,Health Care,Biotechnology: Pharmaceutical Preparations
ERIE,Erie Indemnity Company Class A Common Stock,$257.01,-16.03,-5.871%,11871705686.00,United States,,441414,Finance,Specialty Insurers
ERII,Energy Recovery Inc. Common Stock,$16.07,-0.17,-1.047%,851261583.00,United States,2008,299930,Technology,Industrial Machinery/Components
ES,Eversource Energy (D/B/A) Common Stock,$75.13,0.26,0.347%,28211060384.00,United States,,2336300,Utilities,Electric Utilities: Central
