Symbol,Name,Last Sale,Net Change,% Change,Market Cap,Country,IPO Year,Volume,Sector,Industry
RDVT,Red Violet Inc. Common Stock ,$40.53,-2.08,-4.881%,566276608.00,United States,,109709,Technology,Computer Software: Prepackaged Software
RDW,Redwire Corporation Common Stock,$8.42,0.30,3.695%,1390569593.00,United States,2021,9794575,Industrials,Military/Government/Technical
REAL,The RealReal Inc. Common Stock,$11.61,0.50,4.50%,1354687854.00,United States,2019,4281040,Consumer Discretionary,Other Specialty Stores
REG,Regency Centers Corporation Common Stock,$77.27,0.42,0.547%,14133189968.00,United States,1993,1166504,Real Estate,Real Estate Investment Trusts
REGCO,Regency Centers Corporation 5.875% Series B Cumulative Redeemable Preferred Stock,$22.63,0.06,0.266%,4139175475.00,United States,,191,Real Estate,Real Estate Investment Trusts
REGCP,Regency Centers Corporation 6.25% Series A Cumulative Redeemable Preferred Stock,$23.49,0.03,0.128%,4296475118.00,United States,,826,Real Estate,Real Estate Investment Trusts
REGN,Regeneron Pharmaceuticals Inc. Common Stock,$772.19,-7.48,-0.959%,81635776995.00,United States,1991,628663,Health Care,Biotechnology: Pharmaceutical Preparations
RELY,Remitly Global Inc. Common Stock,$16.19,-0.96,-5.598%,3384453623.00,United States,2021,3682657,Real Estate,Real Estate
REPL,Replimune Group Inc. Common Stock,$8.36,-0.28,-3.241%,690307095.00,United States,2018,875126,Health Care,Biotechnology: Biological Products (No Diagnostic Substances)
REPX,Riley Exploration Permian Inc. Common Stock,$27.63,0.02,0.072%,607000873.00,United States,1999,155487,Energy,Oil & Gas Production
RES,RPC Inc. Common Stock,$6.01,0.07,1.178%,1325652595.00,United States,,1738689,Energy,Oilfield Services/Equipment
REX,REX American Resources Corporation,$34.35,0.52,1.537%,1131410613.00,United States,,145759,Industrials,Major Chemicals
REXR,Rexford Industrial Realty Inc. Common Stock,$37.14,-0.13,-0.349%,8610680106.00,United States,2013,3279077,Real Estate,Real Estate Investment Trusts
REYN,Reynolds Consumer Products Inc. Common Stock,$24.98,0.64,2.629%,5254382079.00,United States,2020,595544,Consumer Discretionary,Containers/Packaging
REZI,Resideo Technologies Inc. Common Stock ,$35.72,1.12,3.237%,5347817800.00,United States,2018,1538015,Industrials,Wholesale Distributors
RF,Regions Financial Corporation Common Stock,$28.44,-0.27,-0.94%,24938367546.00,United States,,15307269,Finance,Major Banks
RFI,Cohen & Steers Total Return Realty Fund Inc. Common Stock,$11.913,-0.017,-0.142%,585388475.00,United States,1993,56349,Finance,Investment Managers
RGA,Reinsurance Group of America Incorporated Common Stock,$218.41,1.83,0.845%,14319652615.00,United States,,345368,Finance,Life Insurance
RGEN,Repligen Corporation Common Stock,$134.67,-1.01,-0.744%,7580675168.00,United States,1986,2219445,Health Care,Biotechnology: Biological Products (No Diagnostic Substances)
RGLD,Royal Gold Inc. Common Stock,$288.04,2.50,0.876%,24428700628.00,United States,,927945,Industrials,Precious Metals
RGNX,REGENXBIO Inc. Common Stock,$8.08,-0.06,-0.737%,409034535.00,United States,2015,575738,Health Care,Biotechnology: Biological Products (No Diagnostic Substances)
RGR,Sturm Ruger & Company Inc. Common Stock,$37.20,-0.22,-0.588%,593126212.00,United States,,152598,Industrials,Ordnance And Accessories
RGTI,Rigetti Computing Inc. Common Stock,$16.48,0.56,3.518%,5438829765.00,United States,,24653591,Technology,EDP Services
RGTIW,Rigetti Computing Inc. Warrants,$6.6899,0.3599,5.686%,2207841459.00,United States,,79032,Technology,EDP Services
RH,RH Common Stock,$190.40,1.02,0.539%,3575273890.00,United States,2012,1001957,Consumer Discretionary,Other Specialty Stores
RHI,Robert Half Inc. Common Stock,$23.60,-0.23,-0.965%,2386988866.00,United States,,3351264,Consumer Discretionary,Professional Services
RHLD,Resolute Holdings Management Common Stock ,$180.81,-3.08,-1.675%,1537010482.00,United States,,102678,Finance,Finance: Consumer Services
RHP,Ryman Hospitality Properties Inc. (REIT),$102.82,-0.29,-0.281%,6478078889.00,United States,,1143439,Real Estate,Real Estate Investment Trusts
RIGL,Rigel Pharmaceuticals Inc. Common Stock,$34.51,-0.95,-2.679%,626402881.00,United States,2000,304744,Health Care,Biotechnology: Pharmaceutical Preparations
RILYG,BRC Group Holdings Inc. 5.00% Senior Notes due 2026,$22.73,-0.22,-0.959%,693198310.00,United States,,6752,Finance,Investment Managers
RILYK,BRC Group Holdings Inc. 5.50% Senior Notes Due 2026,$24.93,-0.02,-0.08%,760291855.00,United States,,4068,Finance,Investment Managers
RILYL,BRC Group Holdings Inc. Depositary Shares each representing 1/1000th in a share of 7.375% Series B Cumulative Perpetual Preferred Stock par value $0.0001,$10.00,0.00,0.00%,312186700.00,United States,,7974,Finance,Investment Managers
RILYN,BRC Group Holdings Inc. 6.50% Senior Notes Due 2026,$23.09,-0.08,-0.345%,704177254.00,United States,,12333,Finance,Investment Managers
RILYP,BRC Group Holdings Inc. Depositary Shares each representing a 1/1000th fractional interest in a share of Series A Cumulative Perpetual Preferred Stock,$9.90,-0.09,-0.901%,309064833.00,United States,,3444,Finance,Investment Managers
RILYT,BRC Group Holdings Inc. 6.00% Senior Notes Due 2028,$17.7001,0.3601,2.077%,539801118.00,United States,,29628,Finance,Investment Managers
RILYZ,BRC Group Holdings Inc. 5.25% Senior Notes due 2028,$16.80,0.47,2.878%,512350709.00,United States,,47161,Finance,Investment Managers
RIOT,Riot Platforms Inc. Common Stock ,$16.50,0.82,5.23%,6134818569.00,United States,,17039097,Finance,Finance: Consumer Services
RITM,Rithm Capital Corp. Common Stock,$10.15,0.14,1.399%,5642308012.00,United States,,10429207,Real Estate,Real Estate Investment Trusts
RIVN,Rivian Automotive Inc. Class A Common Stock,$15.12,-0.15,-0.982%,18763765610.00,United States,2021,20989479,Industrials,Auto Manufacturing
RJET,Republic Airways Holdings Inc. Common Stock,$21.14,1.39,7.038%,991466000.00,United States,2018,98531,Consumer Discretionary,Air Freight/Delivery Services
RJF,Raymond James Financial Inc. Common Stock,$155.48,2.35,1.535%,30643714433.00,United States,,1128772,Finance,Investment Bankers/Brokers/Service
RKLB,Rocket Lab Corporation Common Stock,$69.97,-0.89,-1.256%,37374918620.00,United States,2020,12837357,Industrials,Military/Government/Technical
RKT,Rocket Companies Inc. Class A Common Stock,$17.71,0.62,3.628%,49869412113.00,United States,2020,23893405,Finance,Finance: Consumer Services
RL,Ralph Lauren Corporation Common Stock,$374.13,9.09,2.49%,22648488196.00,United States,1997,493619,Industrials,Garments and Clothing
RLAY,Relay Therapeutics Inc. Common Stock,$9.18,0.48,5.517%,1591099494.00,United States,2020,1314666,Health Care,Biotechnology: Biological Products (No Diagnostic Substances)
RLGT,Radiant Logistics Inc. Common Stock,$7.11,-0.08,-1.113%,332936728.00,United States,,179171,Industrials,Integrated Freight & Logistics
RLI,RLI Corp. Common Stock (DE),$61.11,1.08,1.799%,5617242016.00,United States,,666601,Finance,Property-Casualty Insurers
RLJ,RLJ Lodging Trust Common Shares of Beneficial Interest $0.01 par value,$8.01,-0.05,-0.62%,1210191475.00,United States,2011,1178974,Real Estate,Real Estate Investment Trusts
RLMD,Relmada Therapeutics Inc. Common Stock,$4.26,0.13,3.148%,312401230.00,United States,,1075118,Health Care,Biotechnology: Pharmaceutical Preparations
RMBS,Rambus Inc. Common Stock,$98.57,-4.07,-3.965%,10624932453.00,United States,1997,1459538,Technology,Semiconductors
RMD,ResMed Inc. Common Stock,$251.63,-9.16,-3.512%,36657056044.00,United States,,1034286,Health Care,Medical/Dental Instruments
RMNI,Rimini Street Inc. (DE) Common Stock,$3.35,-0.24,-6.685%,307074400.00,United States,2015,378280,Real Estate,Real Estate
RMR,The RMR Group Inc. Class A Common Stock,$16.35,-0.14,-0.849%,524151194.00,United States,,160807,Consumer Discretionary,Professional Services
RMT,Royce Micro-Cap Trust Inc. Common Stock,$12.25,0.14,1.156%,566796561.00,United States,,156588,Finance,Investment Managers
RNA,Avidity Biosciences Inc. Common Stock,$72.75,-0.11,-0.151%,10961660231.00,United States,2020,5414241,Health Care,Biotechnology: Pharmaceutical Preparations
RNG,RingCentral Inc. Class A Common Stock,$35.19,0.61,1.764%,3046212321.00,United States,2013,3148085,Technology,EDP Services
RNGR,Ranger Energy Services Inc. Class A Common Stock,$17.25,0.20,1.173%,406242468.00,United States,2017,149642,Energy,Oilfield Services/Equipment
RNP,Cohen & Steers REIT and Preferred and Income Fund Inc. Common Shares,$21.52,0.01,0.046%,1057463275.00,United States,2003,140992,Finance,Investment Managers
RNST,Renasant Corporation Common Stock,$38.99,0.07,0.18%,3704883684.00,United States,2023,837678,Finance,Major Banks
ROAD,Construction Partners Inc. Class A Common Stock,$138.88,6.98,5.292%,7848855419.00,United States,2018,616045,Industrials,Military/Government/Technical
ROCK,Gibraltar Industries Inc. Common Stock,$50.79,-2.00,-3.789%,1500471803.00,United States,1993,146192,Industrials,Steel/Iron Ore
ROG,Rogers Corporation Common Stock,$108.22,2.01,1.892%,1929310772.00,United States,1960,133390,Industrials,Major Chemicals
ROK,Rockwell Automation Inc. Common Stock,$405.30,17.67,4.558%,45538660112.00,United States,,1245210,Industrials,Industrial Machinery/Components
ROKU,Roku Inc. Class A Common Stock,$87.68,-1.38,-1.55%,12954875281.00,United States,2017,3244595,Telecommunications,Cable & Other Pay Television Services
ROL,Rollins Inc. Common Stock,$60.51,0.13,0.215%,29110890293.00,United States,,2961468,Consumer Discretionary,Diversified Commercial Services
ROOT,Root Inc. Class A Common Stock,$57.81,-2.71,-4.478%,896573035.00,United States,2020,296976,Finance,Property-Casualty Insurers
ROP,Roper Technologies Inc. Common Stock,$337.70,1.91,0.569%,36349160111.00,United States,1992,1565365,Technology,Computer Software: Programming Data Processing
ROST,Ross Stores Inc. Common Stock,$200.55,-0.90,-0.447%,64866880310.00,United States,1985,1883909,Consumer Discretionary,Clothing/Shoe/Accessory Stores
RPC,Ridgepost Capital Inc. Class A Common Stock,$8.32,0.28,3.483%,915325549.00,United States,2021,668050,Finance,Investment Managers
RPD,Rapid7 Inc. Common Stock,$6.12,-0.45,-6.849%,403265845.00,United States,2015,2188292,Technology,Computer Software: Prepackaged Software
RPM,RPM International Inc. Common Stock,$116.35,0.34,0.293%,14901605717.00,United States,,720252,Consumer Discretionary,Paints/Coatings
RPRX,Royalty Pharma plc Class A Ordinary Shares ,$45.40,0.28,0.621%,26189296586.00,United States,2020,4536449,Health Care,Biotechnology: Pharmaceutical Preparations
RQI,Cohen & Steers Quality Income Realty Fund Inc Common Shares,$13.11,0.07,0.537%,1760678349.00,United States,2002,356649,Finance,Trusts Except Educational Religious and Charitable
RR,Richtech Robotics Inc. Class B Common Stock,$2.57,-0.04,-1.533%,944018193.00,United States,2023,9228429,Industrials,Industrial Machinery/Components
RRBI,Red River Bancshares Inc. Common Stock,$88.36,-1.07,-1.196%,597013971.00,United States,2019,35091,Consumer Discretionary,Hotels/Resorts
RRC,Range Resources Corporation Common Stock,$38.53,-0.05,-0.13%,9129136875.00,United States,,3325421,Energy,Oil & Gas Production
RRR,Red Rock Resorts Inc. Class A Common Stock,$61.78,-2.24,-3.499%,6488557681.00,United States,2016,773194,Consumer Discretionary,Hotels/Resorts
RRX,Regal Rexnord Corporation Common Stock,$223.69,5.48,2.511%,14875291498.00,United States,1976,1147589,Consumer Discretionary,Metal Fabrications
RS,Reliance Inc. Common Stock,$317.11,-5.59,-1.732%,16580718837.00,United States,1994,405101,Industrials,Metal Fabrications
RSG,Republic Services Inc. Common Stock,$220.74,-0.45,-0.203%,68165609078.00,United States,1998,1134205,Utilities,Environmental Services
RSI,Rush Street Interactive Inc. Class A Common Stock,$18.82,0.48,2.617%,4372850055.00,United States,2020,1188149,Consumer Discretionary,Services-Misc. Amusement & Recreation
RSVR,Reservoir Media Inc. Common Stock,$7.49,-0.15,-1.963%,491345640.00,United States,2021,20598,Consumer Discretionary,Services-Misc. Amusement & Recreation
RTO,Rentokil Initial plc American Depositary Shares (each representing five (5) Ordinary Shares),$30.67,-0.66,-2.107%,7734974000.00,United States,2022,1523370,Consumer Discretionary,Other Consumer Services
RTX,RTX Corporation Common Stock,$198.46,-3.46,-1.714%,266390412179.00,United States,,10154162,Industrials,Aerospace
RUM,Rumble Inc. Class A Common Stock,$5.72,-0.16,-2.721%,2487413060.00,United States,2021,2209710,Technology,Computer Software: Programming Data Processing
RUMBW,Rumble Inc. Warrant,$1.5299,0.0049,0.321%,665296021.00,United States,2021,5208,Technology,Computer Software: Programming Data Processing
RUSHA,Rush Enterprises Inc. Common Stock Cl A,$73.58,-1.68,-2.232%,5671650148.00,United States,,503486,Consumer Discretionary,Retail-Auto Dealers and Gas Stations
RUSHB,Rush Enterprises Inc. Class B,$66.81,0.07,0.105%,5149809002.00,United States,,101357,Consumer Discretionary,Retail-Auto Dealers and Gas Stations
RVLV,Revolve Group Inc. Class A Common Stock,$25.90,1.60,6.584%,1847556661.00,United States,2019,3290296,Consumer Discretionary,Catalog/Specialty Distribution
RVMD,Revolution Medicines Inc. Common Stock,$104.83,3.00,2.946%,20265715158.00,United States,2020,1950105,Health Care,Biotechnology: Biological Products (No Diagnostic Substances)
RVMDW,Revolution Medicines Inc. Warrant,$2.01,0.21,11.667%,388572808.00,United States,,37634,Health Care,Biotechnology: Biological Products (No Diagnostic Substances)
RVT,Royce Small-Cap Trust Inc. Common Stock,$18.44,0.18,0.986%,1990721825.00,United States,1986,184197,Finance,Trusts Except Educational Religious and Charitable
RVTY,Revvity Inc. Common Stock,$97.62,0.50,0.515%,11067728122.00,United States,,705584,Industrials,Biotechnology: Laboratory Analytical Instruments
RWAYL,Runway Growth Finance Corp. 7.50% Notes due 2027,$25.155,-0.065,-0.258%,911029378.00,United States,,644,Finance,Finance: Consumer Services
RWAYZ,Runway Growth Finance Corp. 8.00% Notes due 2027,$24.99,-0.01,-0.04%,905053634.00,United States,,9591,Finance,Finance: Consumer Services
RWT,Redwood Trust Inc. Common Stock,$5.98,-0.01,-0.167%,757559616.00,United States,1995,1164383,Real Estate,Real Estate Investment Trusts
RWTN,Redwood Trust Inc. 9.125% Senior Notes Due 2029,$25.10,0.05,0.20%,3243508946.00,United States,2024,5433,Real Estate,Real Estate Investment Trusts
RWTO,Redwood Trust Inc. 9.00% Senior Notes Due 2029,$24.97,0.04,0.16%,3226709896.00,United States,2024,425,Real Estate,Real Estate Investment Trusts
RXO,RXO Inc. Common Stock,$14.84,0.18,1.228%,2436638381.00,United States,2022,1754833,Consumer Discretionary,Transportation Services
RXRX,Recursion Pharmaceuticals Inc. Class A Common Stock,$3.53,0.11,3.216%,1835026675.00,United States,2021,15806343,Health Care,Biotechnology: Biological Products (No Diagnostic Substances)
RXST,RxSight Inc. Common Stock,$8.94,0.31,3.592%,367582762.00,United States,2021,424369,Health Care,Ophthalmic Goods
RXT,Rackspace Technology Inc. Common Stock,$1.46,-0.22,-13.095%,355644495.00,United States,2020,24228205,Technology,Computer Software: Programming Data Processing
RYAM,Rayonier Advanced Materials Inc. Common Stock,$7.17,-0.02,-0.278%,480430102.00,United States,2014,426291,Basic Materials,Paper
RYAN,Ryan Specialty Holdings Inc. Class A Common Stock,$38.86,-0.16,-0.41%,10266411781.00,United States,2021,3381811,Finance,Specialty Insurers
RYN,Rayonier Inc. REIT Common Stock,$21.52,-0.43,-1.959%,3473879256.00,United States,,3634008,Real Estate,Real Estate Investment Trusts
RYTM,Rhythm Pharmaceuticals Inc. Common Stock,$98.65,-1.13,-1.132%,6583511924.00,United States,2017,784446,Health Care,Biotechnology: Pharmaceutical Preparations
RZB,Reinsurance Group of America Incorporated 5.75% Fixed-To-Floating Rate Subordinated Debentures due 2056,$25.30,0.115,0.457%,1658748277.00,United States,2016,463498,Finance,Life Insurance
RZC,Reinsurance Group of America Incorporated 7.125% Fixed-Rate Reset Subordinated Debentures due 2052,$25.58,0.00,0.00%,1677105965.00,United States,2022,58315,Finance,Life Insurance
RZLT,Rezolute Inc. Common Stock (NV),$3.61,0.32,9.726%,345468643.00,United States,,3172050,Health Care,Biotechnology: Pharmaceutical Preparations
S,SentinelOne Inc. Class A Common Stock,$12.76,0.39,3.153%,4336728363.00,United States,2021,7930806,Technology,Computer Software: Prepackaged Software
SABR,Sabre Corporation Common Stock,$0.8176,-0.16,-16.367%,323086931.00,United States,2014,7247749,Technology,Computer Software: Programming Data Processing
SAFE,Safehold Inc. New Common Stock ,$15.90,0.01,0.063%,1140932023.00,United States,2023,360875,Real Estate,Real Estate Investment Trusts
SAFT,Safety Insurance Group Inc. Common Stock,$77.44,-0.98,-1.25%,1153395542.00,United States,2002,63031,Finance,Property-Casualty Insurers
SAH,Sonic Automotive Inc. Common Stock,$62.85,0.10,0.159%,2147753189.00,United States,1997,311633,Consumer Discretionary,Retail-Auto Dealers and Gas Stations
SAIA,Saia Inc. Common Stock,$401.56,-10.07,-2.446%,10698618920.00,United States,,290702,Industrials,Trucking Freight/Courier Services
SAIC,Science Applications International Corporation Common Stock,$87.58,-2.33,-2.591%,3952258918.00,United States,,607568,Technology,EDP Services
SAIL,SailPoint Inc. Common Stock,$13.12,-1.07,-7.541%,7368529971.00,United States,2025,3247552,Technology,Computer Software: Prepackaged Software
SAJ,Saratoga Investment Corp 8.00% Notes due 2027,$25.39,0.08,0.316%,397813846.00,United States,2022,1922,Finance,Investment Managers
SAM,Boston Beer Company Inc. (The) Common Stock,$227.45,3.29,1.468%,2424245802.00,United States,,190690,Consumer Staples,Beverages (Production/Distribution)
SANA,Sana Biotechnology Inc. Common Stock,$4.23,0.22,5.486%,1126728688.00,United States,2021,1386446,Health Care,Biotechnology: Biological Products (No Diagnostic Substances)
SANM,Sanmina Corporation Common Stock,$158.17,8.805,5.895%,8636855135.00,United States,1993,1198073,Technology,Electrical Products
SAR,Saratoga Investment Corp New,$23.17,0.25,1.091%,374984624.00,United States,,84983,Finance,Investment Managers
SARO,StandardAero Inc. Common Stock,$31.84,0.43,1.369%,10649470608.00,United States,2024,1880209,Industrials,Aerospace
SAT,Saratoga Investment Corp 6.00% Notes due 2027,$24.58,-0.04,-0.162%,385122660.00,United States,2022,10290,Finance,Investment Managers
SATS,EchoStar  Corporation Common Stock,$106.78,-3.58,-3.244%,30739432916.00,United States,,3214130,Consumer Discretionary,Telecommunications Equipment
SAY,Saratoga Investment Corp 8.125% Notes due 2027,$25.14,-0.02,-0.079%,393896813.00,United States,2022,7486,Finance,Investment Managers
SAZ,Saratoga Investment Corp 8.50% Notes due 2028,$25.2834,0.0134,0.053%,396143623.00,United States,2023,2741,Finance,Investment Managers
SBAC,SBA Communications Corporation Class A Common Stock,$201.60,2.06,1.032%,21479848387.00,United States,1999,687860,Real Estate,Real Estate Investment Trusts
SBC,SBC Medical Group Holdings Incorporated Common Stock,$3.90,-0.27,-6.475%,400050078.00,United States,2022,26201,Health Care,Medical/Nursing Services
SBCF,Seacoast Banking Corporation of Florida Common Stock,$32.37,-1.38,-4.089%,3166697183.00,United States,,812089,Finance,Major Banks
SBET,Sharplink Inc. Common Stock,$6.55,-0.17,-2.53%,1288340401.00,United States,,6640036,Technology,Computer Software: Prepackaged Software
SBGI,Sinclair Inc. Class A Common Stock,$14.06,-0.54,-3.699%,979751233.00,United States,1995,236222,Industrials,Broadcasting
SBH,Sally Beauty Holdings Inc. (Name to be changed from Sally Holdings Inc.) Common Stock,$16.16,0.44,2.799%,1567662434.00,United States,,1343110,Consumer Discretionary,Other Specialty Stores
SBR,Sabine Royalty Trust Common Stock,$70.16,0.19,0.272%,1022886845.00,United States,,16579,Energy,Oil & Gas Production
SBRA,Sabra Health Care REIT Inc. Common Stock,$20.51,0.58,2.91%,5114161793.00,United States,,2583650,Real Estate,Real Estate Investment Trusts
SBSI,Southside Bancshares Inc. Common Stock,$31.50,0.04,0.127%,947082969.00,United States,,94848,Finance,Major Banks
SBUX,Starbucks Corporation Common Stock,$96.51,-0.98,-1.005%,109950183534.00,United States,1992,6537311,Consumer Discretionary,Restaurants
SCCD,Sachem Capital Corp. 6.00% Notes due 2026,$24.585,0.025,0.102%,1163910150.00,United States,,1416,Real Estate,Real Estate Investment Trusts
SCCE,Sachem Capital Corp. 6.00% Notes due 2027,$23.53,-0.03,-0.127%,1113964037.00,United States,2022,749,Real Estate,Real Estate Investment Trusts
SCCF,Sachem Capital Corp. 7.125% Notes due 2027,$23.55,0.00,0.00%,1114910882.00,United States,2022,1399,Real Estate,Real Estate Investment Trusts
SCCG,Sachem Capital Corp. 8.00% Notes due 2027,$23.6344,-0.0711,-0.30%,1118906572.00,United States,2022,751,Real Estate,Real Estate Investment Trusts
SCCO,Southern Copper Corporation Common Stock,$210.69,3.64,1.758%,171120696663.00,United States,,1883613,Basic Materials,Metal Mining
SCHL,Scholastic Corporation Common Stock,$32.86,0.42,1.295%,836014032.00,United States,1992,350564,Consumer Discretionary,Books
SCHW,Charles Schwab Corporation (The) Common Stock,$93.12,0.37,0.399%,165468352022.00,United States,,13635111,Finance,Investment Bankers/Brokers/Service
SCI,Service Corporation International Common Stock,$80.62,1.17,1.473%,11224211872.00,United States,,938457,Consumer Discretionary,Other Consumer Services
SCL,Stepan Company Common Stock,$52.51,-1.02,-1.905%,1187724478.00,United States,,279907,Consumer Discretionary,Package Goods/Cosmetics
SCM,Stellus Capital Investment Corporation Common Stock,$10.45,0.20,1.951%,302498804.00,United States,2012,276995,Finance,Finance/Investors Services
SCSC,ScanSource Inc. Common Stock,$36.19,-1.05,-2.82%,777375133.00,United States,,186727,Technology,Retail: Computer Software & Peripheral Equipment
SCVL,Shoe Carnival Inc. Common Stock,$21.01,-0.27,-1.269%,575148078.00,United States,1993,287771,Consumer Discretionary,Clothing/Shoe/Accessory Stores
SD,SandRidge Energy Inc. Common Stock,$17.10,0.08,0.47%,628831057.00,United States,2016,239551,Energy,Oil & Gas Production
SDGR,Schrodinger Inc. Common Stock,$11.30,-0.23,-1.995%,832411144.00,United States,2020,1407014,Health Care,Biotechnology: Pharmaceutical Preparations
SDHC,Smith Douglas Homes Corp. Class A Common Stock,$16.38,-0.48,-2.847%,842808903.00,United States,2024,98703,Consumer Discretionary,Homebuilding
SE,Sea Limited American Depositary Shares each representing one Class A Ordinary Share,$107.11,-4.13,-3.713%,63411255131.00,United States,2017,7005642,Consumer Discretionary,Other Consumer Services
SEB,Seaboard Corporation Common Stock,$4988.02,112.24,2.302%,4777495628.00,United States,1996,12651,Industrials,Farming/Seeds/Milling
SEE,Sealed Air Corporation Common Stock,$41.93,-0.06,-0.143%,6168876531.00,United States,,2241306,Industrials,Major Chemicals
SEI,Solaris Energy Infrastructure Inc. Class A Common Stock,$53.46,2.79,5.506%,3659740944.00,United States,2017,3199086,Consumer Discretionary,Oil and Gas Field Machinery
SEIC,SEI Investments Company Common Stock,$80.21,-1.18,-1.45%,9820865076.00,United States,1981,594909,Finance,Investment Bankers/Brokers/Service
SEM,Select Medical Holdings Corporation Common Stock,$14.82,0.04,0.271%,1837934771.00,United States,2009,701713,Health Care,Hospital/Nursing Management
SEMR,SEMrush Holdings Inc. Class A Common Stock,$11.79,-0.01,-0.085%,1758875552.00,United States,2021,1930328,Technology,Computer Software: Prepackaged Software
SENEA,Seneca Foods Corp. Class A Common Stock,$135.25,4.19,3.197%,915212946.00,United States,,42876,Consumer Staples,Packaged Foods
SENEB,Seneca Foods Corp. Class B Common Stock,$130.00,0.00,0.00%,879687120.00,United States,,13,Consumer Staples,Packaged Foods
SENS,Senseonics Holdings Inc. Common Stock,$8.23,0.07,0.858%,336265126.00,United States,,252583,Health Care,Medical/Dental Instruments
SEPN,Septerna Inc. Common Stock,$30.86,3.58,13.123%,1381731565.00,United States,2024,343016,Health Care,Biotechnology: Pharmaceutical Preparations
SERV,Serve Robotics Inc. Common Stock,$9.67,0.18,1.897%,720255271.00,United States,,2443882,Consumer Discretionary,Industrial Specialties
SEZL,Sezzle Inc. Common Stock,$60.65,-2.10,-3.347%,2071385636.00,United States,,741384,Finance,Finance: Consumer Services
SF,Stifel Financial Corporation Common Stock,$113.01,0.62,0.552%,11507619799.00,United States,,1510994,Finance,Investment Bankers/Brokers/Service
SFB,Stifel Financial Corporation 5.20% Senior Notes due 2047,$20.7203,0.111,0.539%,2117063624.00,United States,2017,9595,Finance,Investment Bankers/Brokers/Service
SFBS,ServisFirst Bancshares Inc. Common Stock,$83.68,0.48,0.577%,4570755069.00,United States,,207602,Finance,Major Banks
SFD,Smithfield Foods Inc. Common Stock,$25.38,0.34,1.358%,9977200605.00,United States,2025,902010,Consumer Staples,Meat/Poultry/Fish
SFIX,Stitch Fix Inc. Class A Common Stock,$3.20,-0.28,-8.046%,429436781.00,United States,2017,2127453,Consumer Discretionary,Catalog/Specialty Distribution
SFM,Sprouts Farmers Market Inc. Common Stock,$73.95,6.47,9.588%,6993924262.00,United States,2013,3696132,Consumer Staples,Food Chains
SFNC,Simmons First National Corporation Class A Common Stock,$20.41,-1.06,-4.937%,2953686236.00,United States,,722872,Finance,Major Banks
SFST,Southern First Bancshares Inc. Common Stock,$59.45,-1.27,-2.092%,488460700.00,United States,,80104,Finance,Major Banks
SG,Sweetgreen Inc. Class A Common Stock,$5.41,0.00,0.00%,640400857.00,United States,2021,3178815,Consumer Discretionary,Restaurants
SGI,Somnigroup International Inc. Common Stock,$88.62,1.57,1.804%,18602017006.00,United States,,1987073,Consumer Discretionary,Home Furnishings
SGP,SpyGlass Pharma Inc. Common Stock,$29.29,-0.03,-0.102%,934677994.00,United States,2026,41768,Health Care,Medical/Dental Instruments
